[
  {
    "schema":"fde-agent/evidence-claim/v1","claim_id":"claim-documented-route","tenant_ref":"tenant-demo","subject":{"type":"process-step","id":"route-mismatch"},"predicate":"owned_by","object":{"type":"role","value":"ap-process-owner"},"source_ref":{"source_id":"source-ap-sop","source_digest":"1111111111111111111111111111111111111111111111111111111111111111","claim_candidate_id":"claim-candidate-route-sop","source_span_digest":"aaaaaaaaaaaaaaaaaaaaaaaaaaaaaaaaaaaaaaaaaaaaaaaaaaaaaaaaaaaaaaaa"},"temporal":{"valid_from":"2026-01-01T00:00:00Z","valid_to":null,"observed_at":"2026-08-01T00:00:00Z","recorded_at":"2026-08-01T00:01:00Z"},"readiness_ref":{"readiness_id":"readiness-ap-sop","digest":"bbbbbbbbbbbbbbbbbbbbbbbbbbbbbbbbbbbbbbbbbbbbbbbbbbbbbbbbbbbbbbbb","state":"READY"},"view":"DOCUMENTED","approval":{"status":"UNCHECKED","owner_role":null,"approved_at":null},"confidence":0.8,"status":"ADMITTED","supersedes_claim_id":null,"contradictions":[]
  },
  {
    "schema":"fde-agent/evidence-claim/v1","claim_id":"claim-observed-route","tenant_ref":"tenant-demo","subject":{"type":"process-step","id":"route-mismatch"},"predicate":"owned_by","object":{"type":"role","value":"reconciliation-specialist"},"source_ref":{"source_id":"source-ap-interview","source_digest":"2222222222222222222222222222222222222222222222222222222222222222","claim_candidate_id":"claim-candidate-route-interview","source_span_digest":"cccccccccccccccccccccccccccccccccccccccccccccccccccccccccccccccc"},"temporal":{"valid_from":"2026-01-01T00:00:00Z","valid_to":null,"observed_at":"2026-08-02T00:00:00Z","recorded_at":"2026-08-02T00:01:00Z"},"readiness_ref":{"readiness_id":"readiness-ap-interview","digest":"ddddddddddddddddddddddddddddddddddddddddddddddddddddddddddddd","state":"DEGRADED"},"view":"OBSERVED","approval":{"status":"UNCHECKED","owner_role":null,"approved_at":null},"confidence":0.9,"status":"ADMITTED","supersedes_claim_id":null,"contradictions":[]
  },
  {
    "schema":"fde-agent/evidence-claim/v1","claim_id":"claim-system-po-required","tenant_ref":"tenant-demo","subject":{"type":"process-step","id":"validate-mismatch"},"predicate":"requires","object":{"type":"field","value":"purchase_order_id"},"source_ref":{"source_id":"source-erp-schema","source_digest":"3333333333333333333333333333333333333333333333333333333333333333","claim_candidate_id":"claim-candidate-po-schema","source_span_digest":"eeeeeeeeeeeeeeeeeeeeeeeeeeeeeeeeeeeeeeeeeeeeeeeeeeeeeeeeeeeeeeee"},"temporal":{"valid_from":"2026-01-01T00:00:00Z","valid_to":null,"observed_at":"2026-08-03T00:00:00Z","recorded_at":"2026-08-03T00:01:00Z"},"readiness_ref":{"readiness_id":"readiness-ap-events","digest":"ffffffffffffffffffffffffffffffffffffffffffffffffffffffffffffffff","state":"READY"},"view":"SYSTEM_ENFORCED","approval":{"status":"CONFIRMED","owner_role":"data-owner","approved_at":"2026-08-03T01:00:00Z"},"confidence":1,"status":"ADMITTED","supersedes_claim_id":null,"contradictions":[]
  },
  {
    "schema":"fde-agent/evidence-claim/v1","claim_id":"claim-target-draft","tenant_ref":"tenant-demo","subject":{"type":"process-step","id":"create-draft-case"},"predicate":"action_class","object":{"type":"action-class","value":"DRAFT_ONLY"},"source_ref":{"source_id":"source-target-design","source_digest":"4444444444444444444444444444444444444444444444444444444444444","claim_candidate_id":"claim-candidate-target-draft","source_span_digest":"9999999999999999999999999999999999999999999999999999999999999"},"temporal":{"valid_from":"2026-08-10T00:00:00Z","valid_to":null,"observed_at":"2026-08-10T00:00:00Z","recorded_at":"2026-08-10T00:01:00Z"},"readiness_ref":{"readiness_id":"readiness-target-design","digest":"8888888888888888888888888888888888888888888888888888888888888888","state":"READY"},"view":"APPROVED_TARGET","approval":{"status":"CONFIRMED","owner_role":"ap-process-owner","approved_at":"2026-08-10T02:00:00Z"},"confidence":1,"status":"ADMITTED","supersedes_claim_id":null,"contradictions":[]
  }
]
